{
  "schema_version": "2.0",
  "artifact_type": "merge_decision",
  "project_id": "coar-demo",
  "created_at": "2026-07-14T12:00:00Z",
  "updated_at": "2026-07-14T12:00:00Z",
  "extensions": {},
  "trial_id": "000001_test-main-signal",
  "stage_id": "STAGE-000001-aaaaaaaa",
  "base_revision": 0,
  "overall_status": "approved",
  "card_decisions": [
    {
      "card_id": "RC-000001-01",
      "decision": "accept_with_qualification",
      "qualification": "Tentative until replicated.",
      "canonical_destinations": [
        "research_trajectory/CURRENT_FINDINGS.json",
        "research_trajectory/lines/L0001.json"
      ]
    }
  ],
  "canonical_update_decisions": [
    {
      "path": "research_trajectory/CURRENT_FINDINGS.json",
      "decision": "apply",
      "reason": "Evidence reviewer passed the scoped finding."
    }
  ],
  "conflict_resolution": [],
  "qualifications": [
    "Do not generalize beyond the scoped benchmark."
  ],
  "review_manifest_hash": "0000000000000000000000000000000000000000000000000000000000000000",
  "stage_manifest_hash": "0000000000000000000000000000000000000000000000000000000000000000",
  "lead_rationale": "The evidence is traceable and appropriately scoped."
}
